<?xml version="1.0" encoding="UTF-8" ?>
<!DOCTYPE tm_tc_format SYSTEM "../../../DTDs/tm_tc_format.dtd">

<tm_tc_format protocol="EPD_20.3" type="TC">
	<CSField fid="0" pfid="0" name="ApplicationData" type="structured" byteOrder="big_endian" firstBit="MSB">
		<size bytes="7" bits="0" />				<!-- size in bits = 32 -->
		<globalOffset bytes="0" bits="0" />		<!-- offset in bits = 0 -->
	</CSField>
	
	<CSField fid="1" pfid="0" name="N" type="uint" byteOrder="big_endian" firstBit="MSB">
		<size bytes="1" bits="0" />				<!-- size in bits = 8 -->
		<globalOffset bytes="0" bits="0" />		<!-- offset in bits = 0 -->
	</CSField>


	<CSField fid="2" pfid="0" name="PID" type="uint" byteOrder="big_endian" firstBit="MSB">
		<size bytes="2" bits="0" />				<!-- size in bits = 1 -->
		<globalOffset bytes="1" bits="0" />		<!-- offset in bits = 0 -->
	</CSField>

	<CSField fid="3" pfid="0" name="PIDValue" type="uint" byteOrder="big_endian" firstBit="MSB">
		<size bytes="4" bits="0" />				<!-- size in bits = 3 -->
		<globalOffset bytes="3" bits="0" />		<!-- offset in bits = 1 -->
	</CSField>
</tm_tc_format>
