<?xml version="1.0" encoding="UTF-8" ?>
<!DOCTYPE tm_tc_format SYSTEM "../../../DTDs/tm_tc_format.dtd">

<tm_tc_format protocol="ASW_12.12" type="TM">
	<CSField fid="0" pfid="0" name="SourceData" type="structured" byteOrder="big_endian" firstBit="MSB">
		<size bytes="20" bits="0" />			<!-- size in bits = 4*8 -->
		<globalOffset bytes="0" bits="0" />		<!-- offset in bits = 0 -->
	</CSField>
	<CSField fid="1" pfid="0" name="counter" type="uint" byteOrder="big_endian" firstBit="MSB">
		<size bytes="1" bits="0" />				<!-- size in bits = 16 -->
		<globalOffset bytes="0" bits="0" /> 	<!-- offset in bits = 0 -->
	</CSField>
	<CSField fid="2" pfid="0" name="PMONID" type="uint" byteOrder="big_endian" firstBit="MSB">
		<size bytes="2" bits="0" />				<!-- size in bits = 16 -->
		<globalOffset bytes="1" bits="0" /> 	<!-- offset in bits = 0 -->
	</CSField>
	<CSField fid="3" pfid="0" name="PID" type="uint" byteOrder="big_endian" firstBit="MSB">
		<size bytes="2" bits="0" />				<!-- size in bits = 16 -->
		<globalOffset bytes="3" bits="0" /> 	<!-- offset in bits = 16 -->
	</CSField>
    <CSField fid="4" pfid="0" name="PMON_type" type="uint" byteOrder="big_endian" firstBit="MSB">
        <size bytes="1" bits="0" />				<!-- size in bits = 16 -->
        <globalOffset bytes="5" bits="0" /> 	<!-- offset in bits = 16 -->
	</CSField>
	<CSField fid="5" pfid="0" name="parameter_value" type="uint" byteOrder="big_endian" firstBit="MSB">
        <size bytes="4" bits="0" />				<!-- size in bits = 16 -->
        <globalOffset bytes="6" bits="0" /> 	<!-- offset in bits = 16 -->
	</CSField>
	<CSField fid="6" pfid="0" name="limit_crossed" type="uint" byteOrder="big_endian" firstBit="MSB">
        <size bytes="4" bits="0" />				<!-- size in bits = 16 -->
        <globalOffset bytes="10" bits="0" /> 	<!-- offset in bits = 16 -->
	</CSField>
	<CSField fid="7" pfid="0" name="prev_pmon_status" type="uint" byteOrder="big_endian" firstBit="MSB">
        <size bytes="1" bits="0" />				<!-- size in bits = 16 -->
        <globalOffset bytes="14" bits="0" /> 	<!-- offset in bits = 16 -->
	</CSField>
	<CSField fid="8" pfid="0" name="current_pmon_status" type="uint" byteOrder="big_endian" firstBit="MSB">
        <size bytes="1" bits="0" />				<!-- size in bits = 16 -->
        <globalOffset bytes="15" bits="0" /> 	<!-- offset in bits = 16 -->
	</CSField>
	<CSField fid="9" pfid="0" name="transition_obt" type="uint" byteOrder="big_endian" firstBit="MSB">
        <size bytes="4" bits="0" />				<!-- size in bits = 16 -->
        <globalOffset bytes="16" bits="0" /> 	<!-- offset in bits = 16 -->
	</CSField>
</tm_tc_format>
