<?xml version="1.0" encoding="UTF-8" ?>
<!DOCTYPE tm_tc_format SYSTEM "../../DTDs/tm_tc_format.dtd">

<tm_tc_format protocol="PUS" type="TM">
	<CSField fid="0" pfid="0" name="SecondaryHeader" type="structured" byteOrder="big_endian" firstBit="MSB">
		<size bytes="13" bits="0" />			<!-- size in bits = 32 -->
		<globalOffset bytes="0" bits="0" />		<!-- offset in bits = 0 -->
	</CSField>

	<CSField fid="1" pfid="0" name="Spare" type="flag" byteOrder="big_endian" firstBit="MSB">
		<size bytes="0" bits="1" />				<!-- size in bits = 1 -->
		<globalOffset bytes="0" bits="0" />		<!-- offset in bits = 1 -->
	</CSField>
	
	<CSField fid="2" pfid="0" name="PUSVersion" type="flag" byteOrder="big_endian" firstBit="MSB">
		<size bytes="0" bits="3" />				<!-- size in bits = 3 -->
		<globalOffset bytes="0" bits="1" />		<!-- offset in bits = 1 -->
	</CSField>
	
	<CSField fid="3" pfid="0" name="OBT_Status" type="flag" byteOrder="big_endian" firstBit="MSB">
		<size bytes="0" bits="4" />				<!-- size in bits = 4 -->
		<globalOffset bytes="0" bits="4" />		<!-- offset in bits = 4 -->
	</CSField>

	<CSField fid="4" pfid="0" name="ServiceType" type="enumerated" byteOrder="big_endian" firstBit="MSB">
		<size bytes="1" bits="0" />				<!-- size in bits = 8 -->
		<globalOffset bytes="1" bits="0" />		<!-- offset in bits = 8 -->
	</CSField>

	<CSField fid="5" pfid="0" name="ServiceSubtype" type="enumerated" byteOrder="big_endian" firstBit="MSB">
		<size bytes="1" bits="0" />				<!-- size in bits = 8 -->
		<globalOffset bytes="2" bits="0" />		<!-- offset in bits = 16 -->
	</CSField>

	<CSField fid="6" pfid="0" name="MsgTypeCounter" type="flag" byteOrder="big_endian" firstBit="MSB">
		<size bytes="2" bits="0" />				<!-- size in bits = 16 -->
		<globalOffset bytes="3" bits="0" />		<!-- offset in bits = 24 -->
	</CSField>

	<CSField fid="7" pfid="0" name="DestinationID" type="enumerated" byteOrder="big_endian" firstBit="MSB">
		<size bytes="2" bits="0" />				<!-- size in bits = 8 -->
		<globalOffset bytes="5" bits="0" />		<!-- offset in bits = 16 -->
	</CSField>

	<CSField fid="8" pfid="0" name="OBT_Secs" type="uint" byteOrder="big_endian" firstBit="MSB">
		<size bytes="4" bits="0" />				<!-- size in bits = 32 -->
		<globalOffset bytes="7" bits="0" />		<!-- offset in bytes = 7 -->
	</CSField>

	<CSField fid="9" pfid="0" name="OBT_Finetime" type="uint" byteOrder="big_endian" firstBit="MSB">
		<size bytes="2" bits="0" />				<!-- size in bits = 16 -->
		<globalOffset bytes="11" bits="0" />		<!-- offset in bytes = 11 -->
	</CSField>

	<VSField fid="10" pfid="10" name="SourceData" type="structured" byteOrder="big_endian" firstBit="MSB">
		<constSize bytes="0" bits="0" />		<!-- const size in bits = 0 -->
		<variableSize fidRef="11" unit="bytes"/><!-- vble size = (SourceDataLength x 8) bits -->
		<maxSize bytes="4085" bits="0" />		<!-- max size in bits = 4094 * 8 -->
		<globalOffset bytes="13" bits="0" />	<!-- offset in bits = 32 -->
	</VSField>

	<VRFieldSize fid="11" pfid="10" name="SourceDataLength" /> <!-- in bytes -->

</tm_tc_format>
