<?xml version="1.0" encoding="UTF-8" ?>
<!DOCTYPE tm_tc_format SYSTEM "../../../DTDs/tm_tc_format.dtd">

<tm_tc_format protocol="TC_9.129" type="TC">
	<CSField fid="0" pfid="0" name="ApplicationData" type="structured" byteOrder="big_endian" firstBit="MSB">
		<size bytes="6" bits="0" />				<!-- size in bits = 24 -->
		<globalOffset bytes="0" bits="0" />		<!-- offset in bits = 0 -->
	</CSField>
	<CSField fid="1" pfid="0" name="NextOBTSeconds" type="uint" byteOrder="big_endian" firstBit="MSB">
		<size bytes="4" bits="0" />				<!-- size in bits = 8 -->
		<globalOffset bytes="0" bits="0" />		<!-- offset in bits = 0 -->
	</CSField>
	<CSField fid="2" pfid="0" name="NextOBTFinetime" type="uint" byteOrder="big_endian" firstBit="MSB">
		<size bytes="2" bits="0" />				<!-- size in bits = 16 -->
		<globalOffset bytes="4" bits="0" />		<!-- offset in bits = 1x8 -->
	</CSField>
</tm_tc_format>