<?xml version="1.0" encoding="UTF-8" ?>
<!DOCTYPE tm_tc_format SYSTEM "../../../DTDs/tm_tc_format.dtd">

<tm_tc_format protocol="EPD_6.2" type="TC">
	<CSField fid="0" pfid="0" name="ApplicationData" type="structured" byteOrder="big_endian" firstBit="MSB">
		<size bytes="32" bits="0" />				<!-- size in bits = 64 -->
		<globalOffset bytes="0" bits="0" />		<!-- offset in bits = 0 -->
	</CSField>

	<CSField fid="1" pfid="0" name="MemoryID" type="uint" byteOrder="big_endian" firstBit="MSB">
		<size bytes="1" bits="0" />				<!-- size in bits = 8 -->
		<globalOffset bytes="0" bits="0" />		<!-- offset in bits = 0 -->
	</CSField>

	<CSField fid="2" pfid="0" name="N" type="enumerated" byteOrder="big_endian" firstBit="MSB">
		<size bytes="1" bits="0" />				<!-- size in bits = 8 -->
		<globalOffset bytes="1" bits="0" />		<!-- offset in bits = 8 -->
	</CSField>

	<CSField fid="3" pfid="0" name="StartAddress" type="uint" byteOrder="big_endian" firstBit="MSB">
		<size bytes="4" bits="0" />				<!-- size in bits = 8 -->
		<globalOffset bytes="2" bits="0" />		<!-- offset in bits = 3x8 -->
	</CSField>

	<CSField fid="4" pfid="0" name="Length" type="uint" byteOrder="big_endian" firstBit="MSB">
		<size bytes="2" bits="0" />				<!-- size in bits = 8 -->
		<globalOffset bytes="6" bits="0" />		<!-- offset in bits = 3x8 -->
	</CSField>

	<VSField fid="5" pfid="0" name="DataToWrite" type="string" byteOrder="big_endian" firstBit="MSB">
		<constSize bytes="0" bits="0" />		<!-- const size in bits = 0 -->
		<variableSize fidRef="4" unit="bytes" /><!-- vble size = (DataToWriteLength x 8) bits -->
		<maxSize bytes="256" bits="0" />		<!-- max size in bits = 243 * 8 -->
		<globalOffset bytes="8" bits="0" />		<!-- offset in bits = 32 -->
	</VSField>

	<VRFieldSize fid="6" pfid="5" name="DataToWriteLength" /> <!-- in bytes -->

</tm_tc_format>
