<?xml version="1.0" encoding="UTF-8" ?>
<!DOCTYPE tm_tc_format SYSTEM "../../../DTDs/tm_tc_format.dtd">

<tm_tc_format protocol="ASW_6.6" type="TM">
	<CSField fid="0" pfid="0" name="SourceData" type="structured" byteOrder="big_endian" firstBit="MSB">
		<size bytes="72" bits="0" />			<!-- size in bits = 72*8 -->
		<globalOffset bytes="0" bits="0" />		<!-- offset in bits = 0 -->
	</CSField>
	<CSField fid="1" pfid="0" name="MemoryID" type="uint" byteOrder="big_endian" firstBit="MSB">
		<size bytes="1" bits="0" />				<!-- size in bits = 8 -->
		<globalOffset bytes="0" bits="0" /> 	<!-- offset in bits = 0 -->
	</CSField>
	<CSField fid="2" pfid="0" name="N" type="uint" byteOrder="big_endian" firstBit="MSB">
		<size bytes="1" bits="0" />				<!-- size in bits = 8 -->
		<globalOffset bytes="1" bits="0" /> 	<!-- offset in bits = 0 -->
	</CSField>
	<CSField fid="3" pfid="0" name="StartAddress" type="uint" byteOrder="big_endian" firstBit="MSB">
		<size bytes="4" bits="0" />				<!-- size in bits = 32 -->
		<globalOffset bytes="2" bits="0" /> 	<!-- offset in bits = 16 -->
	</CSField>
    <CSField fid="4" pfid="0" name="Length" type="uint" byteOrder="big_endian" firstBit="MSB">
        <size bytes="2" bits="0" />				<!-- size in bits = 16 -->
        <globalOffset bytes="6" bits="0" /> 	<!-- offset in bits = 48 -->
	</CSField>
	<CSField fid="5" pfid="0" name="Data" type="uint" byteOrder="big_endian" firstBit="MSB">
        <size bytes="64" bits="0" />			<!-- size in bits = 64*8 -->
        <globalOffset bytes="8" bits="0" /> 	<!-- offset in bits = 64 -->
	</CSField>
</tm_tc_format>
