<?xml version="1.0" encoding="UTF-8" ?>
<!DOCTYPE tm_tc_format SYSTEM "../../../DTDs/tm_tc_format.dtd">

<tm_tc_format protocol="ASW_5.4" type="TM">
	<CSField fid="0" pfid="0" name="SourceData" type="structured" byteOrder="big_endian" firstBit="MSB">
		<size bytes="4" bits="0" />			<!-- size in bits = 4*8 -->
		<globalOffset bytes="0" bits="0" />		<!-- offset in bits = 0 -->
	</CSField>
	<CSField fid="1" pfid="0" name="Ev_ID" type="uint" byteOrder="big_endian" firstBit="MSB">
		<size bytes="2" bits="0" />				<!-- size in bits = 16 -->
		<globalOffset bytes="0" bits="0" /> 	<!-- offset in bits = 0 -->
	</CSField>
	<CSField fid="2" pfid="1" name="ErrorCode" type="uint" byteOrder="big_endian" firstBit="MSB">
		<size bytes="2" bits="0" />				<!-- size in bits = 16 -->
		<globalOffset bytes="2" bits="0" /> 	<!-- offset in bits = 16 -->
	</CSField>
</tm_tc_format>

