<?xml version="1.0" encoding="UTF-8" ?>
<!DOCTYPE tm_tc_format SYSTEM "../../../DTDs/tm_tc_format.dtd">

<tm_tc_format protocol="ASW_4.2" type="TM">
	<CSField fid="0" pfid="0" name="SourceData" type="structured" byteOrder="big_endian" firstBit="MSB">
		<size bytes="35" bits="0" />			<!-- size in bits = 4*8 -->
		<globalOffset bytes="0" bits="0" />		<!-- offset in bits = 0 -->
	</CSField>
	<CSField fid="1" pfid="0" name="StartTime" type="uint" byteOrder="big_endian" firstBit="MSB">
		<size bytes="4" bits="0" />				<!-- size in bits = 16 -->
		<globalOffset bytes="0" bits="0" /> 	<!-- offset in bits = 0 -->
	</CSField>
	<CSField fid="2" pfid="0" name="CurrentTime" type="uint" byteOrder="big_endian" firstBit="MSB">
		<size bytes="4" bits="0" />				<!-- size in bits = 16 -->
		<globalOffset bytes="4" bits="0" /> 	<!-- offset in bits = 16 -->
	</CSField>
    <CSField fid="3" pfid="0" name="N" type="uint" byteOrder="big_endian" firstBit="MSB">
		<size bytes="1" bits="0" />				<!-- size in bits = 16 -->
		<globalOffset bytes="8" bits="0" /> 	<!-- offset in bits = 16 -->
	</CSField>
    <CSField fid="4" pfid="0" name="PID" type="uint" byteOrder="big_endian" firstBit="MSB">
		<size bytes="2" bits="0" />				<!-- size in bits = 16 -->
		<globalOffset bytes="9" bits="0" /> 	<!-- offset in bits = 16 -->
	</CSField>
    <CSField fid="5" pfid="0" name="Samples" type="uint" byteOrder="big_endian" firstBit="MSB">
		<size bytes="4" bits="0" />				<!-- size in bits = 16 -->
		<globalOffset bytes="11" bits="0" /> 	<!-- offset in bits = 16 -->
	</CSField>
    <CSField fid="6" pfid="0" name="MaxValue" type="uint" byteOrder="big_endian" firstBit="MSB">
		<size bytes="4" bits="0" />				<!-- size in bits = 16 -->
		<globalOffset bytes="15" bits="0" /> 	<!-- offset in bits = 16 -->
	</CSField>
    <CSField fid="7" pfid="0" name="MaxValueOBT" type="uint" byteOrder="big_endian" firstBit="MSB">
		<size bytes="4" bits="0" />				<!-- size in bits = 16 -->
		<globalOffset bytes="19" bits="0" /> 	<!-- offset in bits = 16 -->
	</CSField>
    <CSField fid="8" pfid="0" name="MinValue" type="uint" byteOrder="big_endian" firstBit="MSB">
		<size bytes="4" bits="0" />				<!-- size in bits = 16 -->
		<globalOffset bytes="23" bits="0" /> 	<!-- offset in bits = 16 -->
	</CSField>
    <CSField fid="9" pfid="0" name="MinValueOBT" type="uint" byteOrder="big_endian" firstBit="MSB">
		<size bytes="4" bits="0" />				<!-- size in bits = 16 -->
		<globalOffset bytes="27" bits="0" /> 	<!-- offset in bits = 16 -->
	</CSField>
    <CSField fid="10" pfid="0" name="MeanValue" type="uint" byteOrder="big_endian" firstBit="MSB">
		<size bytes="4" bits="0" />				<!-- size in bits = 16 -->
		<globalOffset bytes="31" bits="0" /> 	<!-- offset in bits = 16 -->
	</CSField>
</tm_tc_format>