<?xml version="1.0" encoding="UTF-8"?>
<!DOCTYPE tm_tc_format SYSTEM "../../../../DTDs/tm_tc_format.dtd">

<tm_tc_format protocol="EPD_12_5" type="TC">
	<CSField fid="0" pfid="0" name="ApplicationData" type="structured" byteOrder="big_endian" firstBit="MSB">
		<size bytes="13" bits="0" />			<!-- size in bits = 104 -->
		<globalOffset bytes="0" bits="0" />		<!-- offset in bits = 0 -->
	</CSField>

	<CSField fid="1" pfid="0" name="PMON_ID" type="uint" byteOrder="big_endian" firstBit="MSB">
		<size bytes="2" bits="0" />				<!-- size in bits = 16 -->
		<globalOffset bytes="0" bits="0" />		<!-- offset in bits = 16 -->
	</CSField>

	<CSField fid="2" pfid="0" name="Parameter_ID" type="uint" byteOrder="big_endian" firstBit="MSB">
		<size bytes="2" bits="0" />				<!-- size in bits = 16 -->
		<globalOffset bytes="2" bits="0" />		<!-- offset in bits = 0 -->
	</CSField>	

	<CSField fid="3" pfid="0" name="Monitoring_Interval" type="uint" byteOrder="big_endian" firstBit="MSB">
		<size bytes="1" bits="0" />				<!-- size in bits = 16 -->
		<globalOffset bytes="4" bits="0" />		<!-- offset in bits = 16 -->
	</CSField>
		
	<CSField fid="4" pfid="0" name="Low_Limit" type="deduced" byteOrder="big_endian" firstBit="MSB">
		<size bytes="2" bits="0" />				<!-- size in bits = 64 -->
		<globalOffset bytes="5" bits="0" />		<!-- offset in bits = 40 -->
	</CSField>
	
	<CSField fid="5" pfid="0" name="Low_Limit_EV_ID" type="enumerated" byteOrder="big_endian" firstBit="MSB">
		<size bytes="2" bits="0" />				<!-- size in bits = 16 -->
		<globalOffset bytes="7" bits="0" />	<!-- offset in bits = 104 -->
	</CSField>
	
	<CSField fid="6" pfid="0" name="High_Limit" type="deduced" byteOrder="big_endian" firstBit="MSB">
		<size bytes="2" bits="0" />				<!-- size in bits = 64 -->
		<globalOffset bytes="9" bits="0" />	<!-- offset in bits = 120 -->
	</CSField>	
	
	<CSField fid="7" pfid="0" name="High_Limit_EV_ID" type="enumerated" byteOrder="big_endian" firstBit="MSB">
		<size bytes="2" bits="0" />				<!-- size in bits = 16 -->
		<globalOffset bytes="11" bits="0" />	<!-- offset in bits = 184 -->
	</CSField>

</tm_tc_format>
